<?xml version="1.0" encoding="UTF-8"?>
<!DOCTYPE openmdx-ejb-jar PUBLIC "-//openMDX//DTD Enterprise JavaBeans Extension 1.0//EN" "http://www.openmdx.org/dtd/openmdx-ejb-jar_1_0.dtd">
<openmdx-ejb-jar>
	<enterprise-beans>
		<session>
			<ejb-name>Martin</ejb-name>
			<jndi-name>org/openmdx/test/Martin</jndi-name>
			<home-class>TestHomeClass</home-class>
			<local-home-class>TestLocalHomeClass</local-home-class>
		</session>
		<session>
			<ejb-name>Juerg</ejb-name>
			<local-jndi-name>org/openmdx/test/Juerg</local-jndi-name>
		</session>
		<message-driven>
			<ejb-name>Andy</ejb-name>
			<jndi-name>org/openmdx/test/Andy</jndi-name>
			<local-jndi-name>org/openmdx/local/test/Andy</local-jndi-name>
		</message-driven>
	</enterprise-beans>
</openmdx-ejb-jar>	
