<?xml version="1.0" encoding="UTF-8"?>
<!DOCTYPE openmdx-ejb-jar PUBLIC "-//openMDX//DTD Enterprise JavaBeans Extension 1.0//EN" "http://www.openmdx.org/dtd/openmdx-ejb-jar_1_0.dtd">
<openmdx-ejb-jar>
  	<enterprise-beans>
    	<session>
      		<ejb-name>EntityManagerFactory</ejb-name>
			<local-jndi-name>test/openmdx/state2/EntityProviderFactory</local-jndi-name>
	      	<pool>
	        	<initial-capacity>1</initial-capacity>
	        	<maximum-capacity>10</maximum-capacity>
	        	<maximum-wait>10000</maximum-wait>
	      	</pool>
    	</session>
    	<session>
      		<ejb-name>Gateway</ejb-name>
			<jndi-name>test/openmdx/state2/Gateway</jndi-name>
	      	<pool>
	        	<initial-capacity>1</initial-capacity>
	        	<maximum-capacity>10</maximum-capacity>
	        	<maximum-wait>10000</maximum-wait>
	      	</pool>
    	</session>
  	</enterprise-beans>
</openmdx-ejb-jar>
