<?xml version="1.0" encoding="UTF-8"?>
<!DOCTYPE openmdx-ejb-jar PUBLIC "-//openMDX//DTD Enterprise JavaBeans Extension 1.0//EN" "http://www.openmdx.org/dtd/openmdx-ejb-jar_1_0.dtd">
<openmdx-ejb-jar>
	<enterprise-beans>
		<session>
			<ejb-name>Default</ejb-name>
			<resource-ref>
				<res-ref-name>jdbc/datasource[0]</res-ref-name>
				<jndi-name>jdbc/dataproviders</jndi-name>
			</resource-ref>
		</session>
		<session>
			<ejb-name>Numeric</ejb-name>
			<resource-ref>
				<res-ref-name>jdbc/datasource[0]</res-ref-name>
				<jndi-name>jdbc/dataproviders</jndi-name>
			</resource-ref>
		</session>
		<session>
			<ejb-name>Native</ejb-name>
			<resource-ref>
				<res-ref-name>jdbc/datasource[0]</res-ref-name>
				<jndi-name>jdbc/dataproviders</jndi-name>
			</resource-ref>
		</session>
	</enterprise-beans>
</openmdx-ejb-jar>
