<?xml version="1.0" encoding="UTF-8"?>
<!-- edited with XMLSPY v5 rel. 4 U (http://www.xmlspy.com) by Harald Burger (private) -->
<!DOCTYPE openmdx-ejb-jar PUBLIC "-//openMDX//DTD Enterprise JavaBeans Extension 1.0//EN" "http://www.openmdx.org/dtd/openmdx-ejb-jar_1_0.dtd">
<openmdx-ejb-jar>
	<enterprise-beans>
		<session>
			<ejb-name>generic</ejb-name>
			<resource-ref>
				<res-ref-name>jdbc/datasource[0]</res-ref-name>
				<jndi-name>jdbc/dataproviders</jndi-name>
			</resource-ref>
		</session>
		<session>
			<ejb-name>sliced</ejb-name>
			<resource-ref>
				<res-ref-name>jdbc/datasource[0]</res-ref-name>
				<jndi-name>jdbc/dataproviders</jndi-name>
			</resource-ref>
		</session>
		<session>
			<ejb-name>explorer</ejb-name>
			<jndi-name>org/openmdx/test/joining/explorer</jndi-name>
		</session>
	</enterprise-beans>
</openmdx-ejb-jar>
