<?xml version="1.0" encoding="UTF-8"?>
<!DOCTYPE openmdx-ejb-jar PUBLIC "-//openMDX//DTD Enterprise JavaBeans Extension 1.0//EN" "http://www.openmdx.org/dtd/openmdx-ejb-jar_1_0.dtd">
<openmdx-ejb-jar>
  	<enterprise-beans>
    	<session>
      		<ejb-name>gateway1-NoOrNew</ejb-name>
			<jndi-name>org/openmdx/test-ejb-2_1/gateway1/NoOrNew</jndi-name>
	      	<pool>
	        	<initial-capacity>1</initial-capacity>
	        	<maximum-capacity>10</maximum-capacity>
	        	<maximum-wait>10000</maximum-wait>
	      	</pool>
    	</session>
    	<session>
      		<ejb-name>gateway1-Mandatory</ejb-name>
			<jndi-name>org/openmdx/test-ejb-2_1/gateway1/Mandatory</jndi-name>
	      	<pool>
	        	<initial-capacity>1</initial-capacity>
	        	<maximum-capacity>10</maximum-capacity>
	        	<maximum-wait>10000</maximum-wait>
	      	</pool>
    	</session>
    	<session>
      		<ejb-name>gateway1-Never</ejb-name>
			<jndi-name>org/openmdx/test-ejb-2_1/gateway1/Never</jndi-name>
	      	<pool>
	        	<initial-capacity>1</initial-capacity>
	        	<maximum-capacity>10</maximum-capacity>
	        	<maximum-wait>10000</maximum-wait>
	      	</pool>
    	</session>
  	</enterprise-beans>
</openmdx-ejb-jar>
